<?xml version="1.0" encoding="UTF-8"?>
<p:actionInstruction xmlns:p="http://ons.gov.uk/ctp/response/action/message/instruction" xmlns:xsi="http://www.w3.org/2001/XMLSchema-instance" xsi:schemaLocation="http://ons.gov.uk/ctp/response/action/message/instruction actionInstruction.xsd ">
  <actionRequests>
    <actionRequest>
      <responseRequired>true</responseRequired>
      <actionId>1</actionId>
      <actionType>actionType</actionType>
      <address>
        <uprn>1</uprn>
        <postcode>postcode</postcode>
        <latitude>0.0</latitude>
        <longitude>0.0</longitude>
      </address>
      <caseId>1</caseId>
      <questionnaireId>1</questionnaireId>
      <iac>iac</iac>
      <events/>
    </actionRequest>
  </actionRequests>
  <actionUpdates>
    <actionUpdate>
      <responseRequired>true</responseRequired>
      <actionId>1</actionId>
      <priority>highest</priority>
      <events/>
    </actionUpdate>
  </actionUpdates>
  <actionCancels>
    <actionCancel>
      <responseRequired>true</responseRequired>
      <actionId>1</actionId>
      <reason>reason</reason>
    </actionCancel>
  </actionCancels>
</p:actionInstruction>
